[
  {
    "id": "thief-of-secrets",
    "name": "Thief of Secrets",
    "detachment_id": "black-spear-task-force",
    "cost": 25,
    "keyword_restrictions": [
      "Deathwatch"
    ],
    "ability_id": null,
    "is_unique": true,
    "game_version": {
      "edition": "11th",
      "dataslate": "pre-launch-provisional"
    },
    "points_provisional": true,
    "upgrade_tag": false,
    "max_targets": 1
  },
  {
    "id": "osseus-key",
    "name": "Osseus Key",
    "detachment_id": "black-spear-task-force",
    "cost": 15,
    "keyword_restrictions": [
      "Deathwatch"
    ],
    "ability_id": null,
    "is_unique": true,
    "game_version": {
      "edition": "11th",
      "dataslate": "pre-launch-provisional"
    },
    "points_provisional": true,
    "upgrade_tag": false,
    "max_targets": 1
  },
  {
    "id": "beacon-angelis",
    "name": "Beacon Angelis",
    "detachment_id": "black-spear-task-force",
    "cost": 25,
    "keyword_restrictions": [
      "Deathwatch"
    ],
    "ability_id": null,
    "is_unique": true,
    "game_version": {
      "edition": "11th",
      "dataslate": "pre-launch-provisional"
    },
    "points_provisional": true,
    "upgrade_tag": false,
    "max_targets": 1
  },
  {
    "id": "the-tome-of-ectoclades",
    "name": "The Tome of Ectoclades",
    "detachment_id": "black-spear-task-force",
    "cost": 30,
    "keyword_restrictions": [
      "Deathwatch"
    ],
    "ability_id": null,
    "is_unique": true,
    "game_version": {
      "edition": "11th",
      "dataslate": "pre-launch-provisional"
    },
    "points_provisional": true,
    "upgrade_tag": false,
    "max_targets": 1
  }
]
