[
  {
    "id": "armour-of-antoninus",
    "name": "Armour of Antoninus",
    "detachment_id": "blade-of-ultramar",
    "cost": 0,
    "keyword_restrictions": [
      "Adeptus Astartes"
    ],
    "ability_id": null,
    "is_unique": true,
    "game_version": {
      "edition": "11th",
      "dataslate": "pre-launch-provisional"
    },
    "points_provisional": true,
    "upgrade_tag": false,
    "max_targets": 1
  },
  {
    "id": "oath-of-macragge",
    "name": "Oath of Macragge",
    "detachment_id": "blade-of-ultramar",
    "cost": 0,
    "keyword_restrictions": [
      "Adeptus Astartes"
    ],
    "ability_id": null,
    "is_unique": true,
    "game_version": {
      "edition": "11th",
      "dataslate": "pre-launch-provisional"
    },
    "points_provisional": true,
    "upgrade_tag": false,
    "max_targets": 1
  },
  {
    "id": "student-of-the-codex",
    "name": "Student of the Codex",
    "detachment_id": "blade-of-ultramar",
    "cost": 0,
    "keyword_restrictions": [
      "Adeptus Astartes"
    ],
    "ability_id": null,
    "is_unique": true,
    "game_version": {
      "edition": "11th",
      "dataslate": "pre-launch-provisional"
    },
    "points_provisional": true,
    "upgrade_tag": false,
    "max_targets": 1
  },
  {
    "id": "veteran-of-behemoth",
    "name": "Veteran of Behemoth",
    "detachment_id": "blade-of-ultramar",
    "cost": 0,
    "keyword_restrictions": [
      "Adeptus Astartes"
    ],
    "ability_id": null,
    "is_unique": true,
    "game_version": {
      "edition": "11th",
      "dataslate": "pre-launch-provisional"
    },
    "points_provisional": true,
    "upgrade_tag": false,
    "max_targets": 1
  }
]
